{
  "case_id": "TC-020",
  "description": "不利Utilityを受ける位置に居続ける",
  "expected_evaluations": [
    {
      "primary_rule_id": "DEC-03",
      "label": "improve",
      "allowed_related_rule_ids": [],
      "required_concept_tags": [
        "disengage",
        "fight_continuation"
      ],
      "confidence_range": [
        0.75,
        1.0
      ],
      "expect_clip": true,
      "expect_missing_information": false
    }
  ],
  "expected_candidate_rule_ids": [
    "DEC-03"
  ],
  "forbidden_candidate_rule_ids": [],
  "expected_evaluation_count_min": 1,
  "expected_evaluation_count_max": 3,
  "forbidden_input_conclusion_terms": [
    "good",
    "bad",
    "適切",
    "不適切",
    "例外に該当",
    "〜すべき"
  ]
}