{
  "case_id": "TC-033",
  "description": "残り時間が少ない攻めで設置へ向かう",
  "expected_evaluations": [
    {
      "primary_rule_id": "DEC-05",
      "label": "good",
      "allowed_related_rule_ids": [
        "OBJ-02"
      ],
      "required_concept_tags": [
        "time_management",
        "objective_priority"
      ],
      "confidence_range": [
        0.75,
        1
      ],
      "expect_clip": true,
      "expect_missing_information": false
    }
  ],
  "expected_candidate_rule_ids": [
    "DEC-05"
  ],
  "forbidden_candidate_rule_ids": [],
  "expected_evaluation_count_min": 1,
  "expected_evaluation_count_max": 3,
  "forbidden_input_conclusion_terms": [
    "good",
    "bad",
    "適切",
    "不適切",
    "例外に該当",
    "〜すべき"
  ]
}