{
  "case_id": "TC-035",
  "description": "Controllerが味方ピーク直前にSmokeを入れる",
  "expected_evaluations": [
    {
      "primary_rule_id": "ROLE-02",
      "label": "good",
      "allowed_related_rule_ids": [
        "TEAM-02"
      ],
      "required_concept_tags": [
        "smoke_timing"
      ],
      "confidence_range": [
        0.75,
        1
      ],
      "expect_clip": true,
      "expect_missing_information": false
    }
  ],
  "expected_candidate_rule_ids": [
    "ROLE-02"
  ],
  "forbidden_candidate_rule_ids": [],
  "expected_evaluation_count_min": 1,
  "expected_evaluation_count_max": 3,
  "forbidden_input_conclusion_terms": [
    "good",
    "bad",
    "適切",
    "不適切",
    "例外に該当",
    "〜すべき"
  ]
}