{
  "case_id": "TC-032",
  "description": "攻め残り8秒・サイト安全・Spike所持で即設置",
  "expected_evaluations": [
    {
      "primary_rule_id": "OBJ-02",
      "label": "good",
      "allowed_related_rule_ids": [
        "DEC-05"
      ],
      "required_concept_tags": [
        "plant_timing",
        "site_safety"
      ],
      "confidence_range": [
        0.75,
        1
      ],
      "expect_clip": true,
      "expect_missing_information": false
    }
  ],
  "expected_candidate_rule_ids": [
    "OBJ-02"
  ],
  "forbidden_candidate_rule_ids": [],
  "expected_evaluation_count_min": 1,
  "expected_evaluation_count_max": 3,
  "forbidden_input_conclusion_terms": [
    "good",
    "bad",
    "適切",
    "不適切",
    "例外に該当",
    "〜すべき"
  ]
}