{
  "case_id": "TC-023",
  "description": "設置後に時間を使わせる位置へ移動",
  "expected_evaluations": [
    {
      "primary_rule_id": "OBJ-03",
      "label": "good",
      "allowed_related_rule_ids": [],
      "required_concept_tags": [
        "post_plant_time",
        "defuse_time"
      ],
      "confidence_range": [
        0.75,
        1.0
      ],
      "expect_clip": true,
      "expect_missing_information": false
    }
  ],
  "expected_candidate_rule_ids": [
    "OBJ-03"
  ],
  "forbidden_candidate_rule_ids": [],
  "expected_evaluation_count_min": 1,
  "expected_evaluation_count_max": 3,
  "forbidden_input_conclusion_terms": [
    "good",
    "bad",
    "適切",
    "不適切",
    "例外に該当",
    "〜すべき"
  ]
}