{
  "case_id": "TC-010",
  "description": "味方エントリーに合わせる",
  "expected_evaluations": [
    {
      "primary_rule_id": "TEAM-02",
      "label": "good",
      "allowed_related_rule_ids": [],
      "required_concept_tags": [
        "team_timing",
        "tradeability"
      ],
      "confidence_range": [
        0.75,
        1.0
      ],
      "expect_clip": true,
      "expect_missing_information": false
    }
  ],
  "expected_candidate_rule_ids": [
    "TEAM-02"
  ],
  "forbidden_candidate_rule_ids": [],
  "expected_evaluation_count_min": 1,
  "expected_evaluation_count_max": 3,
  "forbidden_input_conclusion_terms": [
    "good",
    "bad",
    "適切",
    "不適切",
    "例外に該当",
    "〜すべき"
  ]
}