{
  "case_id": "TC-026",
  "description": "体一個分かオーバーピークかだけでは判断不能",
  "expected_evaluations": [
    {
      "primary_rule_id": "PEEK-02",
      "label": "unscored",
      "allowed_related_rule_ids": [],
      "required_concept_tags": [
        "peek_selection"
      ],
      "confidence_range": [
        0,
        0.6
      ],
      "expect_clip": false,
      "expect_missing_information": true,
      "expected_unscored_reason_codes": [
        "insufficient_visual_evidence",
        "insufficient_hud_evidence",
        "missing_required_fact",
        "ambiguous_exception",
        "low_confidence",
        "other"
      ]
    }
  ],
  "expected_candidate_rule_ids": [
    "PEEK-02"
  ],
  "forbidden_candidate_rule_ids": [],
  "expected_evaluation_count_min": 1,
  "expected_evaluation_count_max": 3,
  "forbidden_input_conclusion_terms": [
    "good",
    "bad",
    "適切",
    "不適切",
    "例外に該当",
    "〜すべき"
  ]
}